{
  "batch_id": "amelie-lab-inversion-inversion-20261010T171000-jobcenter-multiling-2e9fa59b9567484c",
  "lab_id": "amelie-lab",
  "engine": "inversion",
  "run_id": "inversion-20261010T171000-jobcenter-multilingual",
  "revision": "2e9fa59b9567484cbcca8382d70ac928afa17b9958a12a1e0212c1bf7e6e36a4",
  "created_at": "2026-10-10T17:10:00Z",
  "model": "deepseek/deepseek-chat",
  "intent": "Inversion der Sprachmonopol- und Beistandslogik: Wie Sprach-Communities durch mobile Begleitinfrastruktur die asymmetrische Macht des Jobcenters aufbrechen",
  "ideas": [
    {
      "local_id": "C1",
      "record": {
        "candidate_id": "C1",
        "rank": 1,
        "idea": "CivicBeistand-Netzwerk: Digitale Community-Plattform zur Organisation rechtssicherer Behördenbegleitung (§ 13 Abs. 4 SGB X) mit mobiler Termin-Vorbereitung, GPS-Lotsen-Routing und digitalem Gedächtnisprotokoll.",
        "gap": "Bürger ohne Deutschkenntnisse gehen oft mutterseelenallein in angstbesetzte Termine, wo mündliche Absprachen mangels Zeugen im Nachhinein bestritten werden.",
        "gap_stands_alone": true,
        "who_has_problem": "Geflüchtete, Migranten und prekarisierte Erwerbslose in Deutschland.",
        "why_now": "Smartphones sind universell verfügbar; § 13 Abs. 4 SGB X bietet eine unerschütterliche rechtliche Schutzgarantie.",
        "buildable": "Umsetzbar als Civic-Tech-App mit Geolocation und verschlüsselter Dokumentenablage.",
        "recipient": "Sozialverband Deutschland & Tacheles e.V.",
        "recipient_kind": "civil_society",
        "operator_applied": "OP-1",
        "skeleton": "Ein Pilotnetzwerk in Berlin (Neukölln/Mitte) mit 50 zweisprachigen Beiständen und 300 begleiteten Terminen."
      }
    }
  ],
  "record": {
    "contract_version": "1.2.0",
    "run_id": "inversion-20261010T171000-jobcenter-multilingual",
    "intent": "Inversion der Sprachmonopol- und Beistandslogik: Wie Sprach-Communities durch mobile Begleitinfrastruktur die asymmetrische Macht des Jobcenters aufbrechen",
    "model": "deepseek/deepseek-chat",
    "created_at": "2026-10-10T17:10:00Z",
    "state_missing": [],
    "plan": {
      "area": "Asymmetrische Inversion des Amtssprachenprinzips (§ 19 SGB X) und Re-Organisation migrantischer Beistände",
      "mode_list": [
        "Strafandrohung für Jobcenter-Kunden bei Sprachunkenntnis",
        "Monolinguale Bescheide ohne Übersetzungshilfe",
        "Willkürliches Hausverbot für informelle Übersetzer",
        "Kostenpflichtige Dolmetscherdienste zu Lasten von Bürgergeld-Empfängern"
      ],
      "target_queries": [
        "Rechtsprechung § 13 Abs 4 SGB X Zurückweisung Beistand unzulässig",
        "BSG Urteil Sprachbarriere Sanktion SGB II Rechtsfolgenbelehrung"
      ],
      "class_hint": "A"
    },
    "target": {
      "target": {
        "name": "Monolinguales SGB-II-Verwaltungsverfahren & Amtssprachenmonopol (§ 19 SGB X)",
        "source_url": "https://www.sozialgesetzbuch-sgb.de/sgbx/19.html",
        "source_label": "Klasse A: Bundesgesetz SGB X",
        "anchor_class": "A",
        "who_pays": "Die Steuerzahler für ineffiziente Verfahren, Gerichtsverfahren und Dolmetscher-Notlösungen.",
        "who_carries_burden": "Nicht-deutschsprachige Bürger, die wegen unverstandener Briefe Sanktionen bis zu 30% erleiden, sowie überforderte Sachbearbeiter.",
        "where_data_stops": "Kommunikation endet an der Sprachbarriere; Behördenbriefe landen ungelesen im Müll.",
        "blind_spot": "Die behördliche Fiktion, ein auf Deutsch zugestellter Verwaltungsakt sei 'bekanntgegeben', selbst wenn der Empfänger kein Wort versteht."
      },
      "operator": "OP-1",
      "thesis": "Invertiere die Sprach- und Begleitdynamik: Die Sprach-Community wird vom passiven Bittsteller zum aktiven, zertifizierten Audit- und Begleitkollektiv, das Bescheide per Handykamera vorab entschlüsselt und jede Behördeninteraktion transparent dokumentiert.",
      "candidates": [
        {
          "id": "C1",
          "idea": "CivicBeistand-Protokoll: Ein dezentrales Zertifizierungs- und Begleitnetzwerk, bei dem zweisprachige Bürger per App als offizielle Beistände nach § 13 Abs. 4 SGB X fungieren, Gesprächsnotizen mitstempeln und Behördenwillkür durch Zeugenschaft unmöglich machen.",
          "why_now": "Mobile Signatur- und GPS-Verifizierungstools auf Smartphones erlauben manipulationssichere Terminprotokolle direkt nach Verlassen des Amts.",
          "recipient": "Flüchtlingsrat & Wohlfahrtsverbände",
          "recipient_kind": "association",
          "check_queries": [
            "Rechtssicheres Protokoll Beistand Jobcenter Vorlage",
            "Flüchtlingsrat Begleitnetzwerke Jobcenter"
          ]
        },
        {
          "id": "C2",
          "idea": "Reverse-Sprachcheck für Behörden: Jobcenter erhalten vor dem Postversand ein automatisches 'Verständlichkeits-Scoring' in 15 Sprachen; unverständliche Briefe werden automatisch blockiert.",
          "why_now": "LLMs können Lesbarkeits- und Übersetzungsscores in Echtzeit ermitteln.",
          "recipient": "Bundesagentur für Arbeit IT-Systemhaus",
          "recipient_kind": "institution",
          "check_queries": [
            "Verständliche Verwaltungssprache Prüfsoftware",
            "BA Einfache Sprache Bescheide"
          ]
        }
      ]
    },
    "result": {
      "survivors": [
        {
          "candidate_id": "C1",
          "rank": 1,
          "idea": "CivicBeistand-Netzwerk: Digitale Community-Plattform zur Organisation rechtssicherer Behördenbegleitung (§ 13 Abs. 4 SGB X) mit mobiler Termin-Vorbereitung, GPS-Lotsen-Routing und digitalem Gedächtnisprotokoll.",
          "gap": "Bürger ohne Deutschkenntnisse gehen oft mutterseelenallein in angstbesetzte Termine, wo mündliche Absprachen mangels Zeugen im Nachhinein bestritten werden.",
          "gap_stands_alone": true,
          "who_has_problem": "Geflüchtete, Migranten und prekarisierte Erwerbslose in Deutschland.",
          "why_now": "Smartphones sind universell verfügbar; § 13 Abs. 4 SGB X bietet eine unerschütterliche rechtliche Schutzgarantie.",
          "buildable": "Umsetzbar als Civic-Tech-App mit Geolocation und verschlüsselter Dokumentenablage.",
          "recipient": "Sozialverband Deutschland & Tacheles e.V.",
          "recipient_kind": "civil_society",
          "operator_applied": "OP-1",
          "skeleton": "Ein Pilotnetzwerk in Berlin (Neukölln/Mitte) mit 50 zweisprachigen Beiständen und 300 begleiteten Terminen."
        }
      ],
      "kills": [
        {
          "candidate_id": "C2",
          "reason": "recipient_rule",
          "notes": "Ein behördeninterner Filter löst das Problem des bereits gedruckten Postverkehrs nicht zeitnah."
        }
      ],
      "shortlist": [
        "C1"
      ],
      "proposed_log_entry": {
        "datum": "2026-10-10",
        "target_system": "Monolinguales SGB-II-Verwaltungsverfahren (§ 19 SGB X)",
        "operator": "OP-1",
        "survivor": "C1: CivicBeistand-Netzwerk für rechtssichere Behördenbegleitung",
        "recipient": "Sozialverband Deutschland"
      }
    },
    "accounting": {
      "model_calls": 3,
      "search_queries": 3,
      "cost_usd": 0.021
    }
  },
  "existence_check": false,
  "contract_version": "1.0.0"
}
